Country	ISO3	src	update	xls_saved	lat	lng	Accelerate_R&D_for_vaccines_and_treatment	Additional_funding/financing_for_the_health_system	Encourage_telemedicine,_smarter_use_of_data_for_surveillance_and_tracking	Government_links_for_more_details	Improve_affordability_of_diagnostics_and_treatment_for_all	Increase_access_to_mental_health_services	Increase_supplies_of_diagnostic_tests,_protective_equipment,_ventilators,_essential_medicines	Mobilise_and_protect_health_workers	Optimise_hospital_beds_and_spaces_for_diagnostics_and_treatments	Protection_for_the_elderly	sources
South Korea	KOR				36.338	128.16	National Institute of Health and Centres for Disease Control and Development (CDCD) will fund a $840,000 project supporting the development of vaccines and therapeutics. 		When a person tests positive for the virus and the CDC cannot identify all of the people they may have been in contact with, then detailed information regarding their movements is sent by text message to residents living nearby. There are also a number of privately run services which track confirmed infected patients on the map. 	https://www.wsj.com/articles/inside-the-south-korean-labs-churning-out-coronavirus-tests-11584610667 https://www.nature.com/articles/d41586-020-00740-y?error=cookies_not_supported&code=ce5e43cc-43af-4313-b49a-c99273cb871f  R&D Funding: https://sciencebusiness.net/news/canada-pledges-c275m-coronavirus-rd-adding-global-funding-rush	Centrally funded and subsidised for isolation and hospitalisation• Korea provides tests and subsequent treatment free of charge to patients and the cost is covered by central and local governments and health insurance public corporation. Korea also provides a subsidy to individuals who need to be isolated (both self-isolation and hospitalisation) to support their living costs and penalises those who are suspected to be infected if they refuse to receive diagnostic test or subsequent treatment or go through self-isolation. 	Seven patients in a psychiatric ward in Korea died from COVID-19, in a ward where all but two patients were infected. 	Building  on  the  lessons  of  previous  SARS-CoV-1  and  MERS  outbreaks, Korea has  a strong infrastructure for test kit production, distribution  and  laboratory  analysis. 	Additional health care professionals were recruited to dispatch to Taegu where a cluster of infected cases was found, providing an early, targeted response to mitigate the crisis.	Korea pioneered the approach of putting in place drive-through centres together with a network of 96 public  and  private  laboratories.  More  than  50  drive-through  centres  were  put  in  place  to  boost  the  capacity to quickly identify cases with around 20 000 tests conducted every day.  		
Latvia	LVA				56.874	26.263						The Latvian Physicians' Association together with the Latvian Association of Psychotherapists provide psychological assistance to medical professionals and has set up a free hotline available every business day. Many volunteer students from several Latvian universities have responded to the call to help the doctors fighting COVID-19.  	Exports of medicines vital for the domestic market during state of emergency will be prohibited in Latvia, according to the order published in the Latvian Herald. The State Agency of Medicines has been ordered to compose a list of medicines vital in the state of emergency, considering recommendations of the World Health Organization (WHO) for treatment of COVID-19 and performing risk assessment of medicine accessibility in Latvia. The report will be published and updated on their website. The order provides for prohibiting pharmaceutical companies engaged in medicines wholesale trade to export medicines included on the list of medicines compiled by the State Agency of Medicines, as well as carry said medicines to member states of the European Economic Area. The order was issued, considering the current epidemiological situation to protect the lives of Latvian patients and health interests during the spread of COVID-19, as well as to reduce the risk of supply disruptions of medicines important for Latvian patients and without impacting mutual assistance agreements between countries.<br>Special new structures include mobile testing points of the Emergency medical service and drivethroughs (public and private) have been set up. Since March 23, new additional COVID-19 testing sites have been launched in several cities in the region, where suspected COVID-19 patients can go for state-funded testing if travelling by private car and after pre-registering.  The capacity of COVID-19 laboratory testing capacity has been developed according to the need. Since March 23, 2020 testing for COVID-19 has been provided across Latvia in seven cities, or 13 test delivery sites. State-funded testing is provided by the National reference laboratory and two private companies - E.Gulbis Laboratory and Central Laboratory.  As of April 14, almost 1 500 test samples were conducted in 24 hours. At present, analyses can be transferred to 22 locations in Latvia. The maximum average waiting time for results does not exceed 48 hours. 	To increase or maintain the availability of health workers, overtime working hours are allowed in excess of the maximum overtime hours prescribed by the Labor Law, but not exceeding 60 hours per week for medical practitioners working in the Emergency medical service, in-patient institutions, as well as for epidemiologists working in the CDPC. The government introduced bonuses for doctors, health professionals, health workers and pharmacists combating COVID-19 with an additional 20-50% of the monthly salary for the months of March, April and May. 	COVID-19 testing is provided by: 1) the Emergency medical service teams for patients with severe symptoms; individuals with severe symptoms are required not to leave their residence place. 2) mobile testing points in Riga, Daugavpils, Jekabpils, Liepaja, Ventspils, Madona, Talsi, Cesis, Tukums and Valmiera, if arriving with own vehicle at the time set by prior arrangement, Special new structures include mobile testing points of the Emergency medical service and drivethroughs (public and private). Since March 23, new additional COVID-19 testing sites have been launched in several cities in the region, where suspected COVID-19 patients can go for state-funded testing if travelling by private car and after pre-registering.		
Lithuania	LTU				55.342	24.23					The National Health Insurance Fund (NHIF) cover all necessary COVID-19-related health care services. These are free of charge at the point of use for people who are covered by the compulsory health insurance scheme (98% of population). Screening has been available only to those who meets case definition criteria. Isolation facilities (e.g. hotels) for people unable to self-isolate are provided free of charge.		Starting from 16th of March, the collection of swabs for COVID-19 molecular tests was launched through mobile COVID-19 clinics . By the 31st of March, there were 12 mobile clinics (3 of them in Vilnius). In addition, on the 25th of March it was announced that so-called fever clinics should be rolled out in Lithuanian municipalities, where patients, referred by a GP, and with symptoms of upper respiratory tract infection will be examined for suspected COVID-19. As of 1st April, fever clinics were functioning in Vilnius, Kaunas, Vilkaviškys and Raseiniai municipalities. <br>From 3rd March, the largest university hospital in Lithuania (Kaunas Klinikos) started to produce medical masks using own production capacity. On 13th of March transfer of PPE (e.g. protective respirators, glasses, gloves, disposable footwear, disposable gloves) stored in the State Medical Reserve to ambulance services was arranged. On 26th of March Lithuania has submitted applications to participate in three joint procurements with other countries initiated by the European Commission (EC).  MOH collaborates with the private sector companies to maintain some of the supplies – e.g. the production of disinfection solutions, medical masks and similar medical materials  equipment and protective aprons.  By 3rd April, the about 30 thousand masks have been delivered to various facilities.  Between 28th March and 12th April, Lithuania received hundreds of tons of PPE purchased from China. These included masks and respirators, suits, hats, gloves, etc. The equipment was distributed across major hospitals, ambulance centres, mobile testing points and fever clinics.  By 12th April, 5 million gloves, 2.5 million masks, 300 thousand hats, 200 thousand respirators, 100 thousand foot covers, 100 thousand eye covers, 85 thousand robes and 30 thousand suits were distributed.  	In order to maintain the availability of the health workers, from 13th of March Vilnius Municipality has mandated kindergartens and schools to ensure the education and care of children of medical staff during the national quarantine. Medical staff have the possibility to take their kids to all the same kindergartens during the quarantine. Salaries for physicians fighting COVID-19 were increased by 15 percent on 27th of March. The Vilnius Public Health Bureau and the Crisis Research Center provided training for health care professionals to perform testing for COVID-19 safely. The Institute of Hygiene is responsible for issuing guidelines for infection control measures for healthcare facilities, and provision of training for health care specialists on infection control issues. Practical recommendations for treatment and nursing in the Intensive Care Unit were updated.<br>On 11th of April it was decided that healthcare professionals should be screened for COVID-19 every seven days. Staff working in nursing and long-term care facilities, as well as ICU and ambulance services should be given priority. From 16th of April social care and nursing staff will be tested in as a matter of priority every seven days. 			
Luxembourg	LUX				49.671	6.113	Research Luxembourg has launched a national COVID-19 platform to coordinate research projects and collaborations. The FNR (Fonds National de Recherche) will soon open a special fast-track Call for proposals to support research efforts<br>The COVID-19 task force of the Research Luxembourg initiative announces the launch of CON-VINCE, a scientific study aiming to assess the dynamics of the spread of COVID-19 in the Luxembourg population		the Governement has put in place a platform for telemedecine "econsult.lu" in March 2020		Luxembourg has opened 4 new centers for advanced health care (les centres de soins avancés (CSA)). Free of charge.	A psychological support service is offered 7 days a week, from 7 am to 11 pm	The  Ministry of Interior together with cities and communities organize the distribution of masks to the population	The Gov is offering new fixed term contract to liberal health workers to boost the national health worker reserve. 		The Gov has put in place a special leave for family support in order to take care of a disabled adult or a dependent elderly person living in their household	
Mexico	MEX				22.925	-101.68		The Health Institute for Wellbeing (Instituto de Salud para el Bienestar) authorized MXN 4.5 billion to buy medical devices, medicine and health equipment. Through the Health and the Wellbeing Institute, States will receive transfers up to MXN 15.3 billion (USD 629 million). In addition, States will have advance funding for MXN 10 billion (USD 411 million).	On April 1, the Ministry of Health announced the launch of the app called “COVID-19MX”, that seeks to reinforce knowledge and promote health on the matter of COVID-19, as well as to facilitate exchange of information between health officials and citizens. The app gathers data on the health status of its users and determines whether they belong to risk groups. Additionally, users can use this app for self-diagnosis purposes.		Full coverage to the COVID-19 test is provided in public hospitals for patients that comply with the case definition set by the Ministry of Health. People can take the test in private providers but they have to pay the (unregulated) full price in most of cases. Media reports that the test price can range between 227€ and 378€, while the Ministry of Health has stated that the production cost of the test is 87€.	The government has developed an online and telephone based mental health support system both for the general population and health workers.  	The laboratory capacity has increased with now 38 facilities approved by the MoH (InDRE). The national Health Emergency Agreeement (Acuerdo de Emergencia Sanitaria) was published on March 30th, including the role of different government Secretaries to assure the availability of tests, equipment, medicines, etc. to deal with the crisis. COFEPRIS is accelerating permits for imports and exports of equipments and techonologies donated or purchased for the COVID19 response (e.g. the ones ones recently brought from China); it is also securing its quality, for instance, through CENAPRECE for ventilators and InDRE for diagnostic tests.	Military medical workers and facilities will be part of the response to the pandemic. The national Health Emergency Agreeement (Acuerdo de Emergencia Sanitaria) was published on March 30th, including the role of different government Secretaries to assure the good organisation and availability of human resources. The Institute of Health for Wellbeing (INSABI) opened a call to increase the number of health workers (Doctors of Wellbeing); by April 7, 6,548 doctors and 12,605 nurses have signed up. Online training about COVID19 has been set up for health workers across the country.	The Federal Government has signed an agreement with the National Association of Private Hospitals and the Mexican Consortium of Hospitals, who will make available 50% of their beds in order to free up spce in the public sector to take care around 12,500 patients; the prices paid by the government will be the same as the ones paid to other public institutes (e.g. IMSS, ISSSTE).	Elderly workers and workers with chronic diseases or compromised immune systems are allowed to work remotely with pay during the pandemic crisis. The government has put in place online information and a telephone dedicated for the elderly. As part of the National Time of Health Distance (Jornada Nacional de Sana Distancia), from March 30 onwards, people 60+ years old, pregnant women and people with chronic diseases must remain in their home. 	
Netherlands	NLD				52.426	5.721			In a press conference, the Ministry of Health announced that the governement is planning to introduce two apps for smartphones. One of the apps would be used to track who someone infected with coronavirus has directly contacted. The second app would be used by someone to monitor their own symptoms. The exact nature of the app and under which conditions it will be used, in terms of voluntary or mandatory, data storage, use for data mining, reversbility, etc. are also unclear. This has raised many concerns among the public, scientists, ethiscists and policiticians. 60 scientists and other experts addressed a public letter to the responsible ministers in which they call on them to carefully take into consideration how the use of such an app can have a social impact, may threaten fundamental civil rights, leads to stigmatizing and the effectiveness of this app.   				There are impending shortages in protective equipment, especially face masks. The guidelines for mask use were adjusted on 9 and 18 March. FFP2 masks are now only used when treatment may cause a lot of aerosols (as is the case with intubation and some other medical procedures). In all other cases, surgical masks are considered sufficient .  Hospitals should keep used masks in order to disinfect and reuse them as soon as an approved method becomes available<br>The number of validated test-labs is increased from 15 to 41. These include biovetenary labs, the diagnostic lab from the bloodbank and hospital labs. Total test capacity will increase from  4000 tests per day to 17 500 tests per day.		National  association for intensive care called on hopspitals to upscale IC beds from 1100 to a maximum: 2400 beds. This is still too low in the most likely scenario according to the National institute of Public Health/ national association of nurses says has stated that caring for patients in 2400 beds will be unfeasible given the lack of medical staff. <br>A national coordination center was created at Erasmus Medical Center. This centre distributes corona patients over Dutch hospitals and monitors available beds with a real-time computer system. 	All nursery homes or small-scale facilities for the eldery are closed for visitors at least untill 28 April 2020. Exceptions can be made for people in palliative stage. 	
New Zealand	NZL				-42.558	172.377		NZD 500 million was allocated to the health sector	Government advice states if you need to see a doctor or other medical professional an individual must phone first. Most consultations will happen over the phone, or by videoconference, to stop any risk of the disease spreading by person to person contact. If a face-to-face meeting is required, the doctor or other medical professional will organise this with you.  Advice also issued by Ministry of Health on Managing patients and reporting using Telehealth and online tools 	Mobilising the workforce: https://www.health.govt.nz/our-work/diseases-and-conditions/covid-19-novel-coronavirus/covid-19-novel-coronavirus-information-specific-audiences/covid-19-novel-coronavirus-resources-health-professionals/expressions-interest-covid-19-response	Government announced that it will temporarily remove tariffs on all medical and hygiene imports needed for the COVID-19 response. These include all diagnostic reagents and testing kits used for COVID-19 testing and soap imports.	On Government Covid-19 website, refers individauls to their family doctor is a good starting point. Also promotes the 'Need to talk?' call & text service on 1737. This service is free, available 24 hours a day, 7 days a week and provies the opportunity for individuals to talk it through with a trained counsellor.<br>The Government made further support available for Kiwis wanting to look after their mental wellbeing as a result of change and uncertainty from COVID-19. Three free online tools are now available: • the Mentemia app developed by All Blacks legend Sir John Kirwan • a health journal app called Melon • an e-therapy programme called Staying on Track. Last week the Government launched two additional mental health support programmes  - Getting Through Together and Sparklers at Home – a set of wellbeing activities and resources for parents to use with children at home.	To ensure people do not stockpile medicines, doctors are advised not to provide prescriptions for longer than one month. <br>From 22 April 2020, only approved point of care test kits for COVID-19 will be able to be imported and sold in New Zealand. Tthe importation and sale of all point of care COVID-19 test kits are banned, unless they gain approval. No point of care test for COVID-19 has so far been approved.   This announcement does not affect the test kits currently being used by the Ministry of Health for COVID-19 testing.	The Govt. is encouraging healthcare workers who are retired to return to the workforce, as well as healthcare workers who now have availability due to suspension of non-essential services. <br>Medical interns working in New Zealand have had their scope of work extended to include ‘COVID-19 related health services outside of accredited clinical attachments’ up until November 2020. 	Private hospitals are taking on urgent elective surgeries from the public sector (e.g. cancer surgery). Private hospitals have also cancelled their own elective surgeries.   	Alert level 4 is associated with a range of change to aged care facilities including:  no family visits; termination of non-essential services in aged care; and no audits of facilities <br>Ministry of Health Guidance issued on PPE for community care providers including aged residential care, aged-related community care, disability, hospice, and homecare	
Norway	NOR				61.155	9.77	Norway has undertaken to provide NOK 1.6 billion to CEPI to start developing vaccine candidates against this new strain of coronavirus, covid-19. Norway is now providing extra funding for this work and has increased its annual contribution to CEPI to a total of NOK 278 million (USD 30 million).			https://www.regjeringen.no/en/aktuelt/norway-supports-efforts-to-combat-coronavirus-covid-19-outbreak/id2690617/							
Peru	PER				-12.664	-72.98			On March 27, the MoH authorised the use of telemedicine for different purposes, coinciding with the needs arising from the COVID-19 pandemic in the country.		Peru has defined that all diagnostic test and treatment due to COVID-19 will be free for all their inhabitants, in part, due to the open affiliation in the Integral Health Insurance (SIS) for currently uninsured people. 	Health workers of the Community Centres for Mental Health have maintained access for patients using teleconsultations and in-person crisis interventions when needed during the quarantine time.	The government assured 1 million 400 thousands rapid tests for COVID-19. Also, the MoH has distributed thousands of basic personal protective equipment and specialised equipment for ICU unit workers. Laboratory capacity (PCR for COVID-19) has been decentralised to regions other than Lima, with the support of the National Health Institute that has received extra resources from the government (around €660 000). By May 5, the Peruvian government affirms having the capacity of conducting 20 000 tests per day.	On April 4, a transfer of PEN 720 (around $215) to workers in the medical sector supporting the emergency was announced.	The MoH defined that the Hospital Ate in Lima will be used exclusively for COVID-19 patients, having 50 ICU beds and 150 regular beds. The newly inaugurated Hospital of Vitarte in the Lima region will be also a reference centre for COVID-19 patients, having 50 ICU beds available. In the Callao region, the Naval Hospital has been defined as the reference hospital, totalising 276 ICU beds in the country by March 27. Nine mobile hospitals have been implemented, 4 in Lima and 5 in other regions, along with campaign centres in 12 other cities for triage and taking of samples. The Minstry of Housing has installed 100 new modules in hospitals to increase the spaces destined for COVID-19 related tasks. The team "Te cuido Perú", coordinated by the Ministry of Defense, was created to oversee and assure that quarantines are respected across the country. The government authorised the provision of care between patients affiliated to different health insurance institutions. 	Vaccination against influenza and neumococo has been provided as a home-service for the elderly.	
Poland	POL				52.442	19.72		On 8 March, the authorities unlocked 23.3 million EUR (98 million PLN) for hospitals. On 19 March, the Government has announced additional 7,5 billion PLN package for hospitals in the framework of Covid19 Measures (Tarcza Antykryzysowa)	The government has released an app called "Home Quarantine" that allows people to confirm the place where they are, basic health assessment and direct reporting of danger. It also makes it easier to supply the most-needed items to people who cannot do this themselves.<br>Legislation has been passed to extend and ease the use of phone consultations and implement broader use of video consultations. Now, within designated health care organisations, physicians of all specialties and some nurses can perform remote phone and video consultations, which are recognised as a face-to-face consultations in the reimbursement systems. 	Section on digital: https://www.gov.pl/web/koronawirus/kwarantanna-domowa				Legislation has been passed to facilitate ease of engaging by hospitals retired health workers as well as ease of reassigning helath workers to non-standard tasks and creating non-standard work schdules.		From 16 April, everybody needs to wear a face mask or otherwise cover their nose and mouth while outside of their residence.	
