Country	ISO3	src	update	xls_saved	lat	lng	Accelerate_R&D_for_vaccines_and_treatment	Additional_funding/financing_for_the_health_system	Encourage_telemedicine,_smarter_use_of_data_for_surveillance_and_tracking	Government_links_for_more_details	Improve_affordability_of_diagnostics_and_treatment_for_all	Increase_access_to_mental_health_services	Increase_supplies_of_diagnostic_tests,_protective_equipment,_ventilators,_essential_medicines	Mobilise_and_protect_health_workers	Optimise_hospital_beds_and_spaces_for_diagnostics_and_treatments	Protection_for_the_elderly	sources
Greece	GRC				39.787	21.617		Additional financial support is provided to the Ministry of Health (legislative act “Urgent measures to prevent and limit the spread of COVID-19”) for the recruitment of health personnel and the purchase of healthcare materials related to the treatment of COVID-19. In particular, 90.5 millions additional funding has been provided to MoH to be increased depending on the needs of the health care system. Additionally, further significant funding has been directed to MoH through donations estimated to have surpassed 50 million euro up to 31/3. Furthermore, the 150 euro fines for each offence under the movement restrictions are diverted to the financing of the health system.	Telemedicine services will be established and made available until the first week of April, through the Health Centers, in order to provide services to COVID-19 patients treated at home and coordinate their care. <br>Patients have the ability to receive their regular prescriptions on their mobile phones, as the application for e-prescription through gov.gr is being put on trial.  The new system, accessible to all registered patients: • will improve the day-to-day lives of citizens, especially those who are chronically ill, as they will be served remotely and, at a time when vulnerable groups need to be protected; • will save doctors time, allowing them to focus on cases in need of immediate care, especially in midst of the fight against COVID-19; • Will Increase the ability of the state to monitor pharmaceutical spending by identifying distortions.		In  NHS, there is entitlement to all types of services (primary/ambulatory care, diagnostics, inpatient and outpatient specialist care, including from private providers contracted with EOPYY, etc.) for all individuals with social health insurance, for the unemployed, for those with low incomes, who are entitled to free access to health centres and public hospitals, and for all Greek citizens (or with citizenship of another EU Member State), who are entitled to free access to primary/ambulatory care and specialist outpatient services provided by the NHS. Screening is available for those meeting the definition criteria set by EODY. Since 2016, provides also access to care for migrants irrespective of their legal status (including irregular migrants) suffering apart from life threatening situations, from chronic, mental or rare diseases, people with disabilities hosted in social care units, pregnant women and people with a disability rate of 67% or higher through EOPYY.  All patients hospitalized in private hospitals, either as COVID-19 cases or other non COVID cases who are directed to private ICUs in order to alleviate pressure from the public hospitals,will not be subject to any co-payments.  	Psychological Support Line under the scientific directions and supervision of Psychiatric Clinics of NHS, in cooperation with NGOs and a large number of volunteer psychologists. Services provided concern the following areas: 1. Psychological support for the general population 2. Psychiatric assistance for those with mental health disorders 3. Psychological support for children and their families 4. Psychological support for health professionals 5. Support on social issues	 National Centralised Procurement Agency (EKAPY), in order to allocate resources efficiently and effectively amongst the dedicated COVID-19 Reference Hospitals, has set up a Digital Registry which monitors in real-time the stock and utilisation of all COVID-19 relevant equipment needed in the battle against the pandemic (gloves, masks, protective gear for medical personnel etc), as well as hospital and ICU beds capacity and occupancy. The data are also utilised in econometric modelling forecasting future needs. <br>On March 21, 2020, approximately eight tons of medical supplies were provided by the Chinese government to Greece, including 550,000 masks and sets of protective gear. Eleven tons of medical supplies donated by the United Arab Emirates to Greece arrived on March 26, 2020 in Athens. The supplies and equipment became immediately available to hospitals around the country to help meet the needs of the fight against COVID-19.	After the announcement of the first confirmed COVID-19 case in the country (26/02/2020), all leave of absence of NHS staff in hospitals, primary health care structures and all health facilities were suspended and revoked by order of the Minister of Health and procedures were initiated for the recruitment of additional staff. In addition, scheduled leaves of absence of staff at the National Centre for Emergency Care, regional clinics, health centers and all local health-related facilities were suspended as of the same day. Since March 4, 4,200 job placements have been approved (medical, nursing and support staff) and 2,000 have been completed.  <br>Since March 23, more than 8,000 volunteers have applied through the digital platform (https://ethelontes.gov.gr), created by the Ministry of Health, to offer their services..It is a voluntary program aimed at anyone who can provide assistance, such as doctors, nurses, paramedics, psychologists, medical students, but also retirees from the health sciences. Anyone who wishes to make a contribution to this effort can also participate by providing administrative, technical and any other support to the health system regardless of their qualifications.	Through cooperation of the MoH and Hospitals, 3,307 beds allocated for the hospitalization of COVID-19 cases, if required, have been secured to date (31.3.20), of which 2,805 are currently available.  Plans ito increase bed capacity in Attica (region with the highest confirmed cases) from 1,010 currently to >1500 within two weeks.  <br>The increase in the total number of ICU beds (870) available results from: a) The development of 85 new ICU beds in Public Hospitals b) The conversion of High Dependency Units (HDU), as well as negative pressure chambers or other spaces that had the necessary infrastructure for mechanical ventilation, to ICU c) The provision of 30 ICU beds by Military Hospitals d) The provision of 137 ICU beds by Private Clinics Phase 1 has been completed in 4 weeks and is in place (223beds available)  Phase 2 (in progress) with objective to allocate a total of 400 ICU beds (including the beds  available for Phase 1) exclusively for COVID-19 cases in approximately 2 -3 weeks  	"Help at Home" social protection program aimed at providing organized and systematic care to the elderly, people with disabilities (mobility and physical impairment, psychological disorders etc.) and the financially weak. It entails the operation of a call center which records the requests and needs of residents in each municipality, passing them along to a team of experts for evaluation. Through the program, counseling and psychological support, nursing care, family assistance, home delivery of basic goods such as medicines and food are provided.<br>NPHO issues Additional Guidance for Infection Prevention and Control for Patients with Suspected or Confirmed COVID-19 for long-term care facilities. As part of the measures: - additional supplies distributed to facilities to comply with the new guidelines.  - visits to facilities severely restricted and allowed only an a case-by-case basis with the necessary precautions put in place.	
Hungary	HUN				47.174	19.618							Almost 70 tons of medical and protective equipment arrived in Budapest. As part of a joint purchase by the Ministry of Innovation and Technology and Semmelweis University, the new shipment includes more than 3 million face masks and 86 ventilators.<br>The foreign minister has revealed that Hungary has  received nearly 31 million masks, 133,000 testing kits and 152 ventilators from China, with a further 8 million more masks of the 116 million Hungary has ordered set to arrive shortly..	Healthcare workers will receive a bonus for fighting on the COVID-19 frontline, HUF 500,000.<br>Healthcare workers will receive a bonus for fighting on the COVID-19 frontline, HUF 500,000.	Construction of an emergency hospital is ongoing, and  4 major hospitals outside of Budapest are prepared in case to receive newly infected people at any time.	Persons aged over 65 can only go to the grocery store, drugstore, market or pharmacy between 9 a.m. and 12 p.m. The rest of the population can only do their shopping outside these hours.<br>Local councils are obliged to organize supplies for elderly people staying at home.	
Iceland	ISL				64.826	-18.417				https://www.covid.is/english  https://www.landlaeknir.is/um-embaettid/frettir/frett/item39288/Bidlad-til-heilbrigdisstarfsmanna-og-annarra-starfsmanna-sem-starfa-vid-vidbunad-vegna-COVID-19-um-ad-bida-med-ferdalog-erlendis   https://www.landlaeknir.is/servlet/file/store93/item39666/Lei%C3%B0beiningar%20fyrir%20%C3%A1h%C3%A6ttuh%C3%B3pa_EN_Skjal_10032020.pdf 			Through a partnership between the Icelandic Government and a private company (eCODE Genetics), Iceland is rolling out large-scale COVID-19 testing to anyone who is interested (not limited to those showing symptoms) and isolating people quickly if they test positive.	Healthcare workers in Iceland are encouraged to cancel travel and to remain in the country		Specific guidelines have been issued for those at most at risk, including the elderly. 	
India	IND				22.741	78.236	Therapy trials are going on, including a combination of the two anti-HIV drugs, with press reporting success on following the approval given by the Indian Council of Medical Research last week		Covid-19 mobile App (Aarogya Setu), launched on April 10 to help people identify their risk of contracting Covid-19. Use to be made mandatory for all employees from April 29. The government also asks local authorities in containment zones to ensure 100% coverage.				An emergency health fund of INR 150 billion (USD 2 billion) for treating COVID-19 patients and strengthening the medical infrastructure of the country including for rapidly ramping up the number of testing facilities, Personal Protective Equipment (PPE), Isolation Beds, ICU beds, Ventilators and other essential equipment<br>118 laboratories have been included in the ICMR network of COVID-19 testing with a capacity to test 12,000 samples per day. Furthermore, 22 private lab chains have registered with ICMR (till 24th March 2020) for COVID-19 testing. They have 15,500 collection centers nationwide.		Hospitals have been asked to defer elective surgeries<br>The government capped the price of sanitizer bottles and banned exports of masks, ventilator machines and also textiles used to make masks.		
Ireland	IRL				53.214	-7.588		The state pays EUR 115 mn per month to use the capacity of 18 private hospitals which now effectively work as public hospitals 	Doctors will be paid for non-Covid19 remote consulations for patients with Medical Card or GP Visit Card  April 3: MoH signed two statutory instruments to .  allow for the electronic transfer of prescriptions to a pharmacy via an approved electronic system: the HSE's Healthmail system   		Regardless of coverage status, the Health Service Executive (HSE) will finance the provision of remote consultations by GPs for patients who may have contracted COVID-19 infection including referral (Agreement between HSE and IMO)  Testing available for people in priority groups and symptoms	According to Covid-19 National Action Plan: --- Expand NAS clinical hub, COVID-19 and mental health support desks i.e. significantly expand staff, including clinical advisors, retired GPs and others to provide clinical advice at the support desks within the National Emergency Operations Centre of NAS --- Ensure psychological /social supports are in place for healthcare workers	According to Covid-19 National Action Plan: Ongoing expansion of hospital lab testing and plan for roll-out of widespread community-delivered testing.<br>April 1: Contract with German lab was concluded to carry out 2,000 tests a day (representing around 30% of all test capacity until Apr 13)  By April 20, 27 labs (include one abroad) can process around 10,000 tests a day.	Call for volunteers to work in the public health services directed at health professionals working elsewhere, medical students and other volunteers. Open registration on website  of the Health Service Execitive (HSE)   Simplify the registration process to help recruit retired health professionals (part of Emergeny Measures in the Public Interest (Covid-19) Bill 2020)	--- Restrict hospital outpatient visits and elective sugery --- Provide additional hospital beds --- New framework agreement with private hospitals: They will operate effectively as public hospitals under Section 38 of the Health Act for the duration of the Emergency thus adding over two thousand beds, 9 laboratories, critical care capacity and thousands of staff. Private and public patients will be treated equally and the private hospitals have agreed to do this on a not-for-profit basis. 	On March 27, "cocooning" was introduced to protect people who are over 70 years of age and those who are medically vulnerable to COVID-19. Under cocooning these groups should stay home under all circumstances (initially for 2 weeks)  all visits to hospitals, residential healthcare centres, other residential settings or prisons are stopped with specific exemptions on compassionate grounds  	
Israel*	ISR				30.992	34.834	The research institute Migal is receiving financing from the Ministry of Science and Technology to work on a vaccine against COVID-19. A number of treatment trials are being undertaken in hospitals. <br>A range of trails and new initiatives have begun focused on innovative diagnostics, treatments, and tracking. Initiatives include: An Israeli startup, Scentech Medical, is hoping to help healthcare providers detect the deadly coronavirus through a simple and quick breath test, similar to breathalyzers used on suspected drunk drivers; MigVax, an affiliate of the Migal Galilee Research Institute, is engaged in effort to develop a vaccine against COVID-19, adapting its generic vaccine protocol; Maccabi Health Care Services, one of Israel’s largest health care providers, announced an artificial intelligence algorithm that it says identifies individuals most at risk for severe COVID-19 complications.		Israel is using mobile data to locate people who have been in contact with patients who test positive and to send them a text message that they are legally required to quarantine themselves for 14 days. Their mobile data is monitored to ensure they remain at home. Sheba Medical Center is using a robot to enter rooms with infected patients while protecting staff, and using a telemonitoring app to monitor less severe patients at home. Israel has developed a robot (Temi) that is being used in China, Japan and Korea to do tasks such as taking temperatures and carrying food to patients under quarantine. <br>On March 17 the government approved the cell-phone tracking of infected people to monitor who they may have been in contact with, valid for 30 days, at the end of which the data has to be deleted.    	Section on digital: https://www.cnbc.com/2020/03/27/coronavirus-surveillance-used-by-governments-to-fight-pandemic-privacy-concerns.html; https://www.shebaonline.org/preparation-for-coronavirus-with-telemedicine/; https://www.israel21c.org/israel-confronts-coronavirus-with-innovation-and-chutzpah/<br>https://govextra.gov.il/ministry-of-health/corona/corona-virus-en/		Israel opened a specialised psychiatric ward for coronavirus infected persons, in light of the potential for the virus to spread within inpatient settings and increased risk of some psychiatric patients given underlying conditions and medication regimens. Staff have been undertaking training around delivering care in these specific settings. 	NIS 10 billion allocated (30 March) to increase health sector capacity, including for the procurement of protective gear, medicine and respirators, to increase the number of hospital beds for corona virus patients and the number of tests for the virus. The Ministry of Health is recommending wearing a protective mask in public and at work. 	Under the direction of the Minister of Health and Ministry’s CEO, the Ministry of Health certified 900 registered nurses by means of quick procedure. 			
Italy	ITA				45.282	10.622							The government has purchased 1,800 high intensity ventilators and 3,200 turbine-based ventilators to double the capacity of intensive and sub-intensive care units<br>Subsidized funding or grants by the governemnt to companies that make medical devices and individual protection devices	The possibility of increasing military medical and nursing personnel with an exceptional one-year stop, while military health services are enhanced<br>The ability to retain NHS staff who would qualify for retirement	Private facilities must provide on-duty health personnel, premises and equipment<br>Repurposing of medical equipment and buildings (e.g. hotels) for the medical emergency		
Japan	JPN				35.962	137.855	On 7th of April, the Japanese government allocated 1 million USD to provide Favipiravir to countries in need for free to undertake clinical trials through the United Nations Office for Project Services (UNOPS). As of 7th of April, about 50 countries have reached out to Japan for support and they include some OECD countries such as the Czech Republic, Estonia, Hungary Luxembourg, Slovenia and Turkey.  Japan also participates in the clinical trial of Remdesivir initiated in the USA. As of 28th of April, over 70 countries reached out to Japan and administrative process of providing Favipiravir is finalised for 38 countries.  In addition, on 7th April, the government decided to prepare the supplementary budger for FY2020, which sums 21.6 billion JPY in order to finance international research and development of anti-viral drugs.<br>Subsidies are given for R&D for vaccines, antibody test and treatment. The government decided on 28 March to start the phase lll clinical study of Favipiravir for a treatment of Covid-19.This medicine is stored by the government in case of outbreak of novel influenza. The government financially supports two clinical trials on Covid-19 patients with several drugs including antiviral drugs. 	On 7th April, the government decided to provide the supplementary budget for FY2020, in order to finance infection emergency measures. Part of the budget is used to provide financial support for long-term care providers to implement measures tu prevent the spread of infection.  <br>A number of upward revisions were made in the fee-for-service scheule (so called Shinryo Honshu) to financially support hospitals which provide care to Covid-19 patients. A wider range of telemedicine services have become available temporarily, accompanied by fee schedule revisions. 	To understand better the prevalence of Covid-19, different health care providers have conducted serology tests covering small samples. As of now, the results vary from 1% (at Osaka city university hospital) to 6% (at Keio University hospital). Japanese Red Cross Society collaborate with MHLW to improve the quality of serology test kits by conducting serology tests to the blood samples collected for transfusion from consented individuals in Tokyo and touhoku regions. <br>MHLW announced that a new centralised information system will be launched in the week of 11th May for centrally collecting information of infected patients from all involved stakeholders including health centres, hospitals and patients themselves. This anables to grasp the number of patients through hospitals and local health centres and share information of patient conditions by health centres and hospitals. A number of apps are being development to take care of people with non-severe symptoms staying at home, supported by the Japan Medical Association or regional governments (e.g. Kanagawa, Osaka).	English: https://japan.kantei.go.jp/ongoingtopics/coronavirus_info_e.html, https://www.mhlw.go.jp/stf/seisakunitsuite/bunya/newpage_00032.html  More information available in Japanese at https://www.mhlw.go.jp/stf/seisakunitsuite/bunya/0000164708_00001.html 	MHLW announced that the criteria for medical consultation for suspected Covid-19 cases would be revised to cover more people and to detect more patients who may experience acute worsening symptoms at an earlier stage. Revised criteria are following: 1. One of the following symptoms such as short of breath, sever fatigue, or high fever, 2. fever or coughing among elderly people or those with existing medical problems, 3. common cold like symptpms for more than four days. Previously criteria was more restrictive such as four days of fever above 37.5 degrees. <br>Throughout the country, diagnostic tests were given to those who contacted designated call centres directly or through their doctor and meet certain criteria such as fever above 37.5 degrees, a strong sense of fatigue or a respiration problem. Since 02/03/2020, tests can be given to those whose doctor considers medically necessary. However, tests are considered not widely available. RT-polymerase chain reaction (RT-PCR) testing and subsequent treatment are fully funded by the central government. COVID-19 is categorised as a designated disease from 01/02/2020 and therefore the legislation applied  is  different  from  those  applies  to  other  diseases  (covered  by  health  insurance). On 02/03/2020, tests  were  included in the health insurance coverage without any cost-sharing component, to increase testing. However, RT-PCR tests are not funded for people who do not meet symptomatic criteria. 	Hotline for DV victims has started through SNS on 20th April.  It will be available in 10 languages from 1st May. <br>Hotlines for DV victims have been set up at the central and also regional levels (e.g. Kanagawa, Tokushima) and information to support victims is made available on the website of the Ministry of Health, Labour and Welfare (MHLW). Several hospitals provide mental health services to their workers providing care for COVID-19 patients. 	MHLW plans to approve Remdesivir by 7th May as treatment of Covid infection in Japan, giving priority to severly ill patients, such as those being on ventilator. <br>MHLW approved trained dentists to perform PCR test in case of shortage of doctors and nurses.	Several prefectual governments including Kumamoto, Ibaragi and Osaka have announced to provide special allowancet to frontline health care professionals. For instance, Osaka prefecture has started collecting money for a fund on 22 April and announced to provide the allowance of between JPY 100000 and 200000 (USD 950 and 1900) to health care professionals as it has collected JPY 1 billion (USD 95 million) by 6 May. <br>MHLW requested health care providers to provide training particularly in the area of intensive care and the use of ECMO. MHLW has also requested nurses who are not currently practicing to return to work. 	Osaka prefecture designated two of their hospitals to care only for Covid-19 patients. One of the hospitals is specialised to care for Covid-19 patients with medium level symptoms and it started providing care on 1st May. The other hospital will provide care for Covid-19 patients who are elderly with milder symptoms.<br>On 15 April, the Japan Medical Association started sending JMAT (Japan Medical Association Team) as “COVID-19 JMAT” to take care of Covid-19 patients who have mild symptoms as the request of regional medical associations. JMAT is teamed up voluntarily with doctors, nurses, and other co-medical professionals originally for preparing a disaster in Japan. JMAT had already sent to support the medical care of the Covid patients in the cruise ship from 14 Feb 2020. 	MHLW announced the key points to prevent the spread of infection in nursing care facilities based on the "Revised infection control manual for elderly care facilities" issused in 2019".<br>MHLW issued the first information notice on how to deal with SARS-CoV-2 infection to long-term care (LTC) and other social welfare institutions, child care facilities and schools on 18/02/2020. Since then, a number of information notices were issued. For example, the notice issued on 25/02/2020 included self health assessment to be undertaken by health care professionals and infection prevension measures to be implemented for visitors such as families of hospitalised patients, and suppliers and subcontractors for health care providers. Following these, hospitals and long-term care facilities limit visitors to protect the sick and elderly who stay there. As usual, hand disinfectant is available for visitors to hospitals and long-term care facilities. Masks are secured for staff working at health and long-term care facilities by banning reselling  of  masks and providing a subsidy to companies to produce more masks. At least several hospitals have started to conduct PCR tests to all patients prior to hospitalisation to avoid risks of healthcare-acquired infection. At least several LTC services have temporarily stopped their services to avoid the spread of infection. 	
