Country	ISO3	src	update	xls_saved	lat	lng	Accelerate_R&D_for_vaccines_and_treatment	Additional_funding/financing_for_the_health_system	Encourage_telemedicine,_smarter_use_of_data_for_surveillance_and_tracking	Government_links_for_more_details	Improve_affordability_of_diagnostics_and_treatment_for_all	Increase_access_to_mental_health_services	Increase_supplies_of_diagnostic_tests,_protective_equipment,_ventilators,_essential_medicines	Mobilise_and_protect_health_workers	Optimise_hospital_beds_and_spaces_for_diagnostics_and_treatments	Protection_for_the_elderly	sources
European Union	EU				55	4.5	EUR 45M in R&D funding made available by the European Commission for vaccines, diagnostics, treatments and public health interventions, through the Horizon2020 "Innovative Medicines Initiative" (IMI), a public/private partnership. Expected to be matched with EUR 90M by the pharmaceutical industry. The European Medicines Agency (EMA) has activated its plan for managing emerging health threats, which determines how EMA responds to and communicates on serious public health threats. It provides scientific advice and clinical trial guidance to developers of new vaccines and treatments, scientific advice; and accelerated assessment and conditional marketing authorisation procedures. EMA and the European Network of Centres for Pharmacoepidemiology and Pharmacovigilance (ENCePP) facilitate collaboration among researchers through encouraging all researchers to register  pharmacoepidemiological studies related to the COVID-19 pandemic in the EU PAS Register and to upload and make public study protocols, with a description of the data collected or planned to be collected.										
Finland	FIN				62.716	26.192			Finland’s strategy focuses on testing, tracing, isolating and treating. The progress of the disease can be impeded through extensive testing, effective contact tracing of identified infections and chains of transmission, isolating those whose are ill and quarantining those who have been exposed. As part of this strategy, the Government is continuing with preparations to introduce a mobile application for use in managing the epidemic. A precondition is that the application must be voluntary and must ensure privacy protection.<br>The Finnish Institute for Health and Welfare (THL) is inviting Finnish citizens, based on random sampling, to participate in a study assessing the spread of the new coronavirus in the population. The study will cover all age groups and will be implemented in cooperation with university hospitals. The main purpose of the current study is to gather up-to-date data on how large a proportion of the population has formed antibodies to monitor the extent to which the epidemic has spread in different age groups and regions and how long the antibodies remain in the body. This information will support decision-making when assessing what measures are needed at each stage of the epidemic.  		Services for COVID-19 patients are provided with standard co-payments or fee waivers depending on the individual financial status. Ordinary regulations also apply on sickness allowances. With regard to special measures due to pandemic, persons who have been ordered to stay away from work, in isolation or quarantine, get infectious disease allowance to compensate for earning losses upon physician’s certification. Carers for children under 16 years of age in quarantine are also entitled to the allowance. People who are recommended (vs mandated) to self-isolate or stay away from work are not entitled  to infectious disease allowance		On 20 March, the government announced about EUR 39 million of extra spending on health care to cover expenses related to the coronavirus. The government also plans additional funding to cover local governments' spending. A series of emergency measures was adopted to safeguard medicines and medical supplies. The sale of medical supplies and pharmaceuticals used in the public health-care system is restricted and municipalities are no longer obliged to provide timely non-emergency care (until 13 May).<br>The government restricted the sale of medicines, goods and services used in healthcare services. The aim was to ensure the availability of medicinal products and essential medical supplies as well as the functioning of the distribution chain in Finland in the exceptional conditions caused by the coronavirus.	On 19 March, the government announced that requirements for emergency/first aid staff can be relaxed in order to ease their recruitment for work. The Helsinki-Uusimaa Hospital district has started training existing surgical and ward staff in treating COVID-19 patients, including intensive care. Similar efforts have also been taken by other hospital districts. There have also been discussions on recruiting medical students to do contact tracing as the test capacity increases.   On 25 March, the Government issued a decree to implement the obligation of healthcare professionals to carry out work set out in the Emergency Powers Act. The aim is to ensure sufficient supply of health workers to avoid shortages during the coronavirus epidemic. The decree will be in force from 26 March 2020 to 13 April 2020. In line with the decree, people working in both public and private healthcare who have received training in the field and are between 18 and 68 years of age may be required to work.                                                                                On 23 March, the government decided that emergency conditions justify taking into use the medical supplies and protective equipment stored in the state emergency stockpiling. The aim is to ensure that there is enough protection for healthcare and social welfare professionals throughout the country if the epidemic expands. Protective equipment is mainly reserved for healthcare personnel caring for patients with confirmed or possible SARS-CoV-2 infection, such as face masks and shields. <br>MSAH (Ministry of Social Affairs and Health) decided that emergency conditions justify taking into use the medical supplies and protective equipment stored in the state emergency stockpiling . The aim is to ensure that there is enough protection for healthcare and social welfare professionals throughout the country if the epidemic expands. Protective equipment primarily means personal protective equipment (PPE) for healthcare personnel caring for patients with confirmed or possible SARS-CoV-2 infection, such as face masks and shields, respiratory protective devices, surgical masks, medical gowns, etc.	The number of ICU beds has been estimated at 300 and the number of intensive surveillance beds is about 150-200. After the declaration of the Emergency Powers Act on March 17th, the government instructed all emergency care services to streamline their activities and hospitals to increase their capacity.  Capacity increase has been done by converting operation theatres and recovery areas into intensive care units. Authorities have estimated that the capacity can be doubled if needed. The Helsinki University Central Hospital dedicated one of its buildings to COVID-19 patients. According to the hospital’s CEO, there are currently 280 ventilators in Helsinki and Uusimaa area. According to government, the total number of ventilators in Finland is about 1000.<br>The number of ICU beds has been estimated at 300 and the number of intensive surveillance beds is about 150-200. After the declaration of the Emergency Powers Act on March 17th, the MSAH instructed all emergency care services to streamline their activities and hospitals to increase their capacity.  Capacity increase has been done by converting operation theatres and recovery areas into intensive care units. Authorities have estimated that the capacity can be doubled if needed. Helsinki University Central Hospital dedicated one of its buildings to COVID-19 patients. According to the hospital’s CEO interviews, there are currently 280 ventilators in Helsinki and Uusimaa area. According to Ministry of Social Affairs and Health, the total number of ventilators in Finland is about 1000.	Day care centers closed. Visitors will be banned from care institutions, health care units and hospitals, with the exception of asymptomatic family members of children and critically ill individuals, family members of those in hospice care and spouses or support persons in the maternity ward, who will be permitted to visit on a case-by-case basis	
France	FRA				46.656	2.543	EUR 50M in R&D funding made available through an "emergency fund" by the Ministry for Higher Education and Research. Longer-term commitments to fund R&D also announced.<br>The government requested on 30.03.2020 tthat French scientific publications and data on the Covid-19 become publicly available  The Ministry of health will finance from now on  11 projects with a budget of almost 9 millions EUR. 	To acknowledge the mobilization of hospital professionals an exceptional bonus will be given as of May 2020 as follows: 1) Staff working in the 30 departments the most affected by the epidemic will receive a bonus of 1500€. 2) in the other departments, staff who worked in COVID+ wards of 108 reference hospitals, will receive a bonus of 1500€. Staff in the other wards will receive a 500€ bonus. 3) Overtime hours generated by the crisis will be paid an enhanced rate of 50%. Therefore hospital staff working in departements and wards the most strained by the epidemic could receive through the bonus and overtime up to a total in the range of 2000€. After the crisis the Minister for Solidarity and Health will study how to revalorize the health profession and their wages. Also an exceptional bonus will be given to professionals working in medical social centers, particularly the EHPADS.<br>French Minister of Health announced close to 1 million euros additional or anticipated revenue payments to health centers to deal with the Covid-19 crisis. Garantee of funding is set up so that the effects of confinement and deprogramming does not result in a fall of resources	Telemedicine promoted by government, including relaxing restrictions on prior face-to-face communications (patients can now consult remotely with any doctor that uses telemedicine, whether or not they have consulted  that  doctor  face-to-face  in  the  past).<br>There is a new portal to report Covid-19 cases in real time from the first potential or confirmed case in nursing homes and other health &social institutions (établissements sociaux et médico-sociaux (ESMS)). It aims to to rapidly detect and track a Covid-19 infection among residents and / or staff in real time.	https://solidarites-sante.gouv.fr/actualites/presse/communiques-de-presse/article/renforcement-des-mesures-pour-les-personnes-agees-11-03-2020  Section on digital: https://www.iledefrance.ars.sante.fr/covid-19-favoriser-la-telemedecine-pour-faciliter-le-suivi-des-patients;   R&D Funding: https://www.enseignementsup-recherche.gouv.fr/cid150594/un-effort-de-25-milliards-d-euros-pour-relever-les-defis-de-la-recherche.html	Regulated insurance coverage with limited out-of-pocket payments incurred by the population. The cost of a coronavirus test has been regulated at 54€ with 70% covered through the Social Security and the rest through complementary private insurance.<br>The government has  decided to make financial advances to hospitals. It also plans to grant significant additional funding to Public Health France for the purchase of masks  The government has decided that the ceiling on non-permanent resources that ACOSS (National Fund of the Urssaf network) is authorized to mobilize, set in the 2020 social security financing law to the amount of  EUR 39 million, will be raised to EUR 70 million.	 Creation of a national platform of medico pyscololgical support for all health professionals. A toll free phone number is availale 7d/7 for all health professionals who wish to talk about what they are experiencing	History of mask shortage in France. Santé Publique France is in charge of masks.<br>Government simplified control procedures of imported masks from 26.03.2020: The Government has therefore decided to adapt the control of compliance with standards for this equipment. There are two cases: - CE marked masks can now be freely imported, regardless of the national requisition mechanism - Companies  are invited to import masks if necessary for the pursuit of their activity, and to show solidarity in their supplies with smaller companies in their sector helping them to stock up. - For other equipment imported without CE marking and whose conformity must be checked, the customs administration is facilitating the passage in customs. Note that before the crisis, any imported product had to meet European health standards, and therefore display the CE logo.	The Government has decided to grant liberal health professionals flat-rate daily allowances paid by Health Insurance in order to guarantee them a replacement income if they are forced to interrupt their activity in the event of illness or because of measures of 'isolation.<br>Since March 15, possibilities for postponing social and tax deadlines were rendered possible or even automatised for the self-employed, including liberal professionals.	Evolution of call triage (SAMU) to do optimise beds at hospitals<br>France has a total of 5,000 intensive care beds, and it also has 7,000 intensive care beds that can be quickly configured to receive patients with Covid-19. It can also count on  11,000 anesthetists and resuscitators. 	the government sent masks to LTC workers, limits outings of workers in nursing homes, limits visits to nursing homes of family members, reinforces health workers. Isolation within therooms of nursing homes is recommended. For those at home, GPs and associations should do surveillance and reinforces telemedecine. The Plan bleu in health centres limits visits<br>On 19 March, the government asked to nursing homes to confine any ill residents with Covid19 symptoms.	
Germany	DEU				51.394	9.657	Additional R&D funding of EUR 165M for Covid-19 R&D through the Federal Ministry for Education and Research, including EUR 150 for CEPI (vaccines) and EUR 15M for basic research and the development of treatments.  The Ministry of Education and Reseach supports the creation of a reseach network of university hospitals with EUR 150m.  The state of North Rhine-Wesphalia financed the first serotological study in the German hotpsot Heinsberg to assess overall populatoin immunity 8 weeks after the first infections.<br>Germany committs to contribute EUR 525m to the "Global Response" initiative of WHO which fosters and co-ordinates research on Covid-19 diagnostics,medication and vaccines	Law "Covid-19 Krankenhausentlastungsgesetz" came into effect on March 29, 2020. Among other things it stipulates that --- Hospitals receive financial compensation for postponed elective surgeries --- Hospitals receive a bonus of EUR 50,000 per created and maintained intensive care bed. --- Practicing phaysians and psychotherapists in an outpatient setting will receive financial compensation if drop in activity will result in reduced practice revenues --- in the hospital sector the total costs for the federal buget is estimated at EUR 2.8 bn and EUR 6.3bn for SHI funds<br>Federal Cabinet approves 2nd law to protect the popualation agsint epdiemicic of national scale: It includes bonus payments to all workers in LTC in 2020 up to EUR 1,000	Deutsche Telekom, a local carrier, has handed over 5 gigabytes of data on its 46 million mobile customers to the Robert Koch Institute (RKI), Germany's national disease control center. It is unclear how these data will be used and what controls are in place to ensure that privacy is protected (it is virtually impossible to anonymise location data).  The associations of SHI-affiliated doctors and SHI funds ageed to lift the existing limit on video-consultations (20% of all servcies) on March 16. A number of serological studies will be conducted by the Robert-Koch Institute, among which one nationwide study including 15,000 people participants (First testing planned in May) RKI released a mobile application on April 7 based on voluntary participation to get better information how the virus spread in the country. It works in conjunction with fitness apps and smartwatches and offeres addiontal data like actiivty levels and sleep patterns and pulse and aims to contribute to assess the effectiveness of measures to constrain the spead of Covid-19  <br>Federal government plans to expand tracking capacities in local health offices: per 20,000 population a team of 5 people should track infections and contacts.  According to plans, each local health office can recive EUR 150,000 to update IT hardware and software.Local health offices will be directly connected to tracing -apps when they are rolled-out	Section on affordability: https://www.aok-bv.de/hintergrund/dossier/aerztliche_versorgung/index_23292.html  Section of protection of elderly: https://www.biva.de/besuchseinschraenkungen-in-alten-und-pflegeheimen-wegen-corona/  Section on health workers: https://www.aerzteblatt.de/nachrichten/111202/COVID-19-Bundesaerztekammer-Praesident-ruft-Aerzte-im-Ruhestand-und-Medizinstudierende-zur-Mithilfe-auf https://www.bundesgesundheitsministerium.de/presse/pressemitteilungen/2020/1-quartal/corona-gesetzespaket-im-bundesrat.html  Section on supply (procurement) https://www.bundesgesundheitsministerium.de/ministerium/meldungen/2020/beschaffung-von-schutzausruestung.html#c17714  Section on hospital beds: https://www.bundesgesundheitsministerium.de/presse/pressemitteilungen/2020/1-quartal/corona-gesetzespaket-im-bundesrat.html http://www.divi.de/register/intensivregister?view=items  Section on digital/telemedicine https://www.politico.eu/article/coroanvirus-covid19-surveillance-data/ https://www.kbv.de/html/1150_44943.php  Info on R&D:  https://www.bmbf.de/de/karliczek-zu-corona-wir-tun-alles-was-in-unserer-macht-steht-11249.html https://www.bmbf.de/de/corona-krise-achtsamkeit-ja-alarmismus-nein-11069.html	Costs of the Covid-19 tests are gernally covered by the Statutory Health Insurance. In the first weeks, only patiens who either had contact to a confirmed case or had been to a risk zone (as identified by the Robert Koch Institute) were available for testing. Since February 28, the decision who should be tested lies with the doctor. The SHI pay EUR 59 per test as agreed between SHI funds and provider representative in the context of the self-governing strcutures. <br>Federal Cabinet approves 2nd law to protect the popualation agsint epdiemicic of national scale: One measure include will allow the Minister of Health to decree that SHI funds will have to pay for test regardless of symptoms of patients. This could also apply to imnunity tests. 		Export of medical equipment prohibited on March 3.  Federal govevernment organises procurement of protective equipment. Simplified procurement procedure "open house" in place since March 27. Fixed price for all manufacturers that can guarantee quality and deliver at least 25,000 units  Federal government orders 10,000 ventilators from manufacturer Drägerwerk (13/03)  Federal government committed to increase testing capacity from currently 650k per week (15/04)  <br>New Task Force within the Ministry of Economics and Technilogy will be establish to coordindate the increase of production capacity of medical protective equipment in Germany (09/04)	General call for volunteers directed at retired physicians, licensed physicians working in different professions and medical students (professionals are asked to contact the Medical Chambers in each Land for co-ordination of volunteers).  Hospitals receive additional payments of EUR 50 per patient between April 1 and June 30 to purchase protective gear for health workers.	Law "Covid-19 Krankenhausentlastungsgesetz" came into effect on March 29, 2020. It stipulates that --- Hospitals receive financial compensation for postponed elective surgeries --- Hospitals receive a bonus of EUR 50,000 per created and maintained intensive care bed.  For an efficient allocation of intensive care beds with respiratory support the RKI, the German hospital association (DKG) and the German Association for intensive and emergency care (DIVI) has set up a website (17/03) where each hospital is asked to provide a daily update on available capacity for beds with respiratory support. This platform is expected to help a better regional coordination of treatment.  On April 6, the Minister mandated all hospitals to participate in this platform.    <br>Hospitals are encouraged to gradually to rreturn to "normal activity" (i.e. end the postponement of elective surgeries) in ealrly May but should reserve 25-30% of ICU capacity for Covid-19 patients (Statement MoH)	For nursing homes this depends on the measures introduced at the Länder level. In most Länder, visiting hours in nursing homes have generally been suspended. There may be some exceptions to this under particular circumsatances.	
